{
  "id": "bangkok",
  "name": { "en": "Bangkok" },
  "tagline": { "en": "Eight areas. Pick the one that fits you, then pick a hotel near a station." },
  "camera": { "center": [100.54, 13.745], "zoom": 11.9, "pitch": 45, "bearing": -10 },
  "camera2d": { "center": [100.54, 13.745], "zoom": 11.7, "pitch": 0, "bearing": 0 },
  "stations": "cities/bangkok.stations.json",
  "lines": "cities/bangkok.lines.json",
  "areas": ["sukhumvit", "siam", "silom", "riverside", "old-town", "chinatown", "ari", "thonglor-ekkamai"]
}
